{
  "$schema": "http://json-schema.org/draft-07/schema#",
  "$id": "https://nvl.io/schemas/deployment.v1alpha1.schema.json",
  "title": "NVL Deployment v1alpha1",
  "type": "object",
  "additionalProperties": false,
  "required": [
    "apiVersion",
    "kind",
    "name",
    "providers",
    "install_sources",
    "routers",
    "storages",
    "esxi_groups",
    "vcenters"
  ],
  "properties": {
    "apiVersion": {
      "const": "nvl.io/v1alpha1"
    },
    "kind": {
      "const": "Deployment"
    },
    "name": {
      "type": "string",
      "minLength": 1,
      "pattern": "^[a-z0-9][a-z0-9-]*[a-z0-9]$|^[a-z0-9]$"
    },
    "providers": {
      "type": "object",
      "required": ["primary"],
      "additionalProperties": {
        "$ref": "#/$defs/provider"
      },
      "properties": {
        "primary": {
          "$ref": "#/$defs/provider"
        }
      }
    },
    "install_sources": {
      "$ref": "#/$defs/namedMap"
    },
    "routers": {
      "$ref": "#/$defs/namedMap"
    },
    "storages": {
      "$ref": "#/$defs/namedMap"
    },
    "esxi_groups": {
      "$ref": "#/$defs/namedMap"
    },
    "vcenters": {
      "$ref": "#/$defs/namedMap"
    },
    "credentials": {
      "type": "object",
      "additionalProperties": true
    },
    "ssh_authorized_keys": {
      "type": "array",
      "items": {
        "type": "string"
      }
    },
    "metadata": {
      "type": "object",
      "additionalProperties": true
    }
  },
  "$defs": {
    "namedMap": {
      "type": "object",
      "additionalProperties": {
        "type": "object",
        "additionalProperties": true
      }
    },
    "provider": {
      "type": "object",
      "required": ["kind"],
      "additionalProperties": true,
      "properties": {
        "kind": {
          "type": "string",
          "enum": ["vsphere", "static", "vcd"]
        },
        "credentials": {
          "type": "object",
          "additionalProperties": true
        },
        "placement_defaults": {
          "type": "object",
          "additionalProperties": true
        }
      }
    }
  }
}
